GOOGLE_REVIEWS ID,Business Rating,Business Reviews,Source URL,Business Name,Author Name,Local Guide,Review Text,Review Rating,Review Date,Author URL,Topic Keywords,Topics
1,3.3,703 reviews,"https://www.google.ca/maps/place/Canadian+Tire/@43.1718328,-80.2474798,17z/data=!3m1!4b1!4m10!1m2!2m1!1scanadian+tire!3m6!1s0x882c65baad6f5e09:0x2b32377dd4265875!8m2!3d43.1718289!4d-80.2452911!9m1!1b1","Canadian Tire - Brantford, ON",Karimah  Kelly,Local Guide,"a big store and sometimes hard to find what i came for. the good thing is, staff were easy to find which helped me locate it and check out with ease. canadian tire carries a lot of quality items like camp gear, kitchenware, gardening, home …",4 stars,2 months ago,https://www.google.com/maps/contrib/111631545485687925605/reviews?hl=en-CA,"[store, hard, find, good, staff, find, check, canadian, tire, items]","[2, 4, 1]"
2,3.3,703 reviews,"https://www.google.ca/maps/place/Canadian+Tire/@43.1718328,-80.2474798,17z/data=!3m1!4b1!4m10!1m2!2m1!1scanadian+tire!3m6!1s0x882c65baad6f5e09:0x2b32377dd4265875!8m2!3d43.1718289!4d-80.2452911!9m1!1b1","Canadian Tire - Brantford, ON",Marcus  Connors,"","if ct is going to lock up low value consumables, at least have enough staff to unlock a case when customers are attempting to purchase. waited 10 min for an associate to answer page before walking out. home depot was happy for the business!!",1 star,2 weeks ago,https://www.google.com/maps/contrib/100463776955151682238/reviews?hl=en-CA,"[staff, customers]",[2]
3,3.3,703 reviews,"https://www.google.ca/maps/place/Canadian+Tire/@43.1718328,-80.2474798,17z/data=!3m1!4b1!4m10!1m2!2m1!1scanadian+tire!3m6!1s0x882c65baad6f5e09:0x2b32377dd4265875!8m2!3d43.1718289!4d-80.2452911!9m1!1b1","Canadian Tire - Brantford, ON",John,Local Guide,"always a great place for tools and supplies. clean, organized and helpful staff. sometimes it's hard to find staff to ask for assistance (especially to have locked cabinets opened).",4 stars,3 weeks ago,https://www.google.com/maps/contrib/104314647582482209619/reviews?hl=en-CA,"[great, place, clean, helpful, staff, hard, find, staff]","[2, 3, 4]"
4,3.3,703 reviews,"https://www.google.ca/maps/place/Canadian+Tire/@43.1718328,-80.2474798,17z/data=!3m1!4b1!4m10!1m2!2m1!1scanadian+tire!3m6!1s0x882c65baad6f5e09:0x2b32377dd4265875!8m2!3d43.1718289!4d-80.2452911!9m1!1b1","Canadian Tire - Brantford, ON",Eileen  Armstrong,"",shame on you! all i needed was a battery put in. i'm a 60 year old woman who was far from home with an unexpected dead battery. a good samaritan gave me a boost so i could get to the service centre before they closed to get a new one. by …,1 star,3 months ago,https://www.google.com/maps/contrib/114490848772530141355/reviews?hl=en-CA,"[needed, good, service]","[4, 3]"
5,3.3,703 reviews,"https://www.google.ca/maps/place/Canadian+Tire/@43.1718328,-80.2474798,17z/data=!3m1!4b1!4m10!1m2!2m1!1scanadian+tire!3m6!1s0x882c65baad6f5e09:0x2b32377dd4265875!8m2!3d43.1718289!4d-80.2452911!9m1!1b1","Canadian Tire - Brantford, ON",Raymond  Hogart,"","guys at counter where you get batteries were excellent. the automotive aisle , organization and product choices are poor . other canadian tire stores have much more to offer",3 stars,2 weeks ago,https://www.google.com/maps/contrib/113957953534784461637/reviews?hl=en-CA,"[automotive, product, poor, canadian, tire, stores]","[4, 1]"
6,3.3,703 reviews,"https://www.google.ca/maps/place/Canadian+Tire/@43.1718328,-80.2474798,17z/data=!3m1!4b1!4m10!1m2!2m1!1scanadian+tire!3m6!1s0x882c65baad6f5e09:0x2b32377dd4265875!8m2!3d43.1718289!4d-80.2452911!9m1!1b1","Canadian Tire - Brantford, ON",Colin  Cousins,Local Guide,"my daughter and i went to the store, not necessarily looking for anything in particular, but we saw many good deals. i bought one item i needed, using the self serve counter. an efficient way to check out!",4 stars,2 months ago,https://www.google.com/maps/contrib/108159667744794383130/reviews?hl=en-CA,"[store, good, bought, item, needed, check]","[4, 1]"
7,3.3,703 reviews,"https://www.google.ca/maps/place/Canadian+Tire/@43.1718328,-80.2474798,17z/data=!3m1!4b1!4m10!1m2!2m1!1scanadian+tire!3m6!1s0x882c65baad6f5e09:0x2b32377dd4265875!8m2!3d43.1718289!4d-80.2452911!9m1!1b1","Canadian Tire - Brantford, ON",Jenn  Dick,Local Guide,the staff at the auto service counter were very helpful getting me a quote for tires. the electronic kiosk was useful to find which aisle to find the items i needed. they have a wide selection of products at reasonable prices. their sales …,4 stars,6 months ago,https://www.google.com/maps/contrib/110307906516077229536/reviews?hl=en-CA,"[staff, auto, service, helpful, tires, find, find, items, needed, selection, products, prices, sales]","[2, 3, 4, 1]"
8,3.3,703 reviews,"https://www.google.ca/maps/place/Canadian+Tire/@43.1718328,-80.2474798,17z/data=!3m1!4b1!4m10!1m2!2m1!1scanadian+tire!3m6!1s0x882c65baad6f5e09:0x2b32377dd4265875!8m2!3d43.1718289!4d-80.2452911!9m1!1b1","Canadian Tire - Brantford, ON",Pamela  Massey,Local Guide,traveling to london from niagara hit a piece of metal and went right to canadian tire to have tire fixed. the service was immediate and outstanding. they were able to fix tire at a fraction of cost of what our local mechanic charges. thank you guys at brantford canadian tire !!!,5 stars,3 months ago,https://www.google.com/maps/contrib/114175837954277582988/reviews?hl=en-CA,"[canadian, tire, tire, service, tire, brantford, canadian, tire]","[4, 3]"
9,3.3,703 reviews,"https://www.google.ca/maps/place/Canadian+Tire/@43.1718328,-80.2474798,17z/data=!3m1!4b1!4m10!1m2!2m1!1scanadian+tire!3m6!1s0x882c65baad6f5e09:0x2b32377dd4265875!8m2!3d43.1718289!4d-80.2452911!9m1!1b1","Canadian Tire - Brantford, ON",Kayleen  Howey,Local Guide,shelves are often bare in areas and disorganized. you could stand in the same spot or walk up and down in a main isle or at a service desk (sports desk) for 20 minutes and never see an employee around. they have good sales though... if it isn't already sold out or in stock.,3 stars,3 weeks ago,https://www.google.com/maps/contrib/115695918831796995502/reviews?hl=en-CA,"[service, desk, minutes, good, sales, stock]","[3, 4, 1]"
10,3.3,703 reviews,"https://www.google.ca/maps/place/Canadian+Tire/@43.1718328,-80.2474798,17z/data=!3m1!4b1!4m10!1m2!2m1!1scanadian+tire!3m6!1s0x882c65baad6f5e09:0x2b32377dd4265875!8m2!3d43.1718289!4d-80.2452911!9m1!1b1","Canadian Tire - Brantford, ON",Rick  Hewitson,"","excellent. love canadian tire. it's my go to store. great staff, very helpful.",5 stars,2 weeks ago,https://www.google.com/maps/contrib/102607575519237457413/reviews?hl=en-CA,"[canadian, tire, store, great, staff, helpful]","[4, 1, 2, 3]"
11,3.3,703 reviews,"https://www.google.ca/maps/place/Canadian+Tire/@43.1718328,-80.2474798,17z/data=!3m1!4b1!4m10!1m2!2m1!1scanadian+tire!3m6!1s0x882c65baad6f5e09:0x2b32377dd4265875!8m2!3d43.1718289!4d-80.2452911!9m1!1b1","Canadian Tire - Brantford, ON",barb  draper,"",terrible customer service. in a retail world where most places will price match they wouldn't honor a sale price in their own flyer because the item was a different color. this is the second time i've had an issue with their service .,1 star,2 months ago,https://www.google.com/maps/contrib/113224246877757074238/reviews?hl=en-CA,"[terrible, customer, service, price, sale, price, item, time, service]","[3, 1, 2]"
12,3.3,703 reviews,"https://www.google.ca/maps/place/Canadian+Tire/@43.1718328,-80.2474798,17z/data=!3m1!4b1!4m10!1m2!2m1!1scanadian+tire!3m6!1s0x882c65baad6f5e09:0x2b32377dd4265875!8m2!3d43.1718289!4d-80.2452911!9m1!1b1","Canadian Tire - Brantford, ON",nana  deb,Local Guide,"i needed a click radio. i searched for a staff member and asked for clock radios. he didnt know, so he searched for another staff member who might know. that staff member thought they were 2 aisles over and if they weren't, come and find …",3 stars,4 months ago,https://www.google.com/maps/contrib/103822585605085825393/reviews?hl=en-CA,"[needed, staff, asked, staff, staff, find]","[2, 4]"
13,3.3,703 reviews,"https://www.google.ca/maps/place/Canadian+Tire/@43.1718328,-80.2474798,17z/data=!3m1!4b1!4m10!1m2!2m1!1scanadian+tire!3m6!1s0x882c65baad6f5e09:0x2b32377dd4265875!8m2!3d43.1718289!4d-80.2452911!9m1!1b1","Canadian Tire - Brantford, ON",Melissa  Gregory,Local Guide,"i rarely shop at canadian tire because my customer service experiences here are always lacking. however, i came in on monday to purchase some mason jars. i was greeted at the door by a young man promoting the store credit card. i …",3 stars,4 months ago,https://www.google.com/maps/contrib/104663662607322366144/reviews?hl=en-CA,"[shop, canadian, tire, customer, service, store]","[3, 4, 1]"
14,3.3,703 reviews,"https://www.google.ca/maps/place/Canadian+Tire/@43.1718328,-80.2474798,17z/data=!3m1!4b1!4m10!1m2!2m1!1scanadian+tire!3m6!1s0x882c65baad6f5e09:0x2b32377dd4265875!8m2!3d43.1718289!4d-80.2452911!9m1!1b1","Canadian Tire - Brantford, ON",canuckrcp,Local Guide,i went to purchase a new smoke and carbon monoxide detector. not being very familiar with the layout of the store i asked the first associate where i should go. she reluctantly gave me vague directions. once i got to that part of the …,3 stars,3 months ago,https://www.google.com/maps/contrib/117793569032821212800/reviews?hl=en-CA,"[store, asked]","[1, 2]"
16,3.3,703 reviews,"https://www.google.ca/maps/place/Canadian+Tire/@43.1718328,-80.2474798,17z/data=!3m1!4b1!4m10!1m2!2m1!1scanadian+tire!3m6!1s0x882c65baad6f5e09:0x2b32377dd4265875!8m2!3d43.1718289!4d-80.2452911!9m1!1b1","Canadian Tire - Brantford, ON",Amanda  Donnelly,Local Guide,can usually find what i am looking for. nothing special to write about. if you need a staff member they are extremely hard to find. better off going to the customer service desk and getting them to help or page someone. experience today …,3 stars,3 months ago,https://www.google.com/maps/contrib/111589387641161689208/reviews?hl=en-CA,"[find, staff, hard, find, customer, service, desk, experience]","[2, 3]"
17,3.3,703 reviews,"https://www.google.ca/maps/place/Canadian+Tire/@43.1718328,-80.2474798,17z/data=!3m1!4b1!4m10!1m2!2m1!1scanadian+tire!3m6!1s0x882c65baad6f5e09:0x2b32377dd4265875!8m2!3d43.1718289!4d-80.2452911!9m1!1b1","Canadian Tire - Brantford, ON",Bobbie  Goss,Local Guide,this is one of the bigger stores but staff were not overly helpful. lots of prices missing but at least you can scan the barcode to check.,3 stars,2 weeks ago,https://www.google.com/maps/contrib/101157278513958956703/reviews?hl=en-CA,"[stores, staff, helpful, prices, check]","[2, 4]"
18,3.3,703 reviews,"https://www.google.ca/maps/place/Canadian+Tire/@43.1718328,-80.2474798,17z/data=!3m1!4b1!4m10!1m2!2m1!1scanadian+tire!3m6!1s0x882c65baad6f5e09:0x2b32377dd4265875!8m2!3d43.1718289!4d-80.2452911!9m1!1b1","Canadian Tire - Brantford, ON",shantell  mckelvie,Local Guide,customer service was not great i am a petite lady i was struggling with a new vacuum and a new pots and pans set both are big boxes everyone just kept walking by me ..and when i finally got to checkout i asked for the 30 dollar gift card …,3 stars,a month ago,https://www.google.com/maps/contrib/108305074876673139165/reviews?hl=en-CA,"[customer, service, great, asked]","[3, 2]"
19,3.3,703 reviews,"https://www.google.ca/maps/place/Canadian+Tire/@43.1718328,-80.2474798,17z/data=!3m1!4b1!4m10!1m2!2m1!1scanadian+tire!3m6!1s0x882c65baad6f5e09:0x2b32377dd4265875!8m2!3d43.1718289!4d-80.2452911!9m1!1b1","Canadian Tire - Brantford, ON",Shannon  McIntyre,Local Guide,"the website and the store may match, technically, but it was a pain in the butt to find the items i went got specifically. i went for moving boxes and they were 5 aisles over in a top shelf that couldn't be seen or reached.",4 stars,2 months ago,https://www.google.com/maps/contrib/118291347084744087597/reviews?hl=en-CA,"[store, find, items]","[2, 1]"
20,3.3,703 reviews,"https://www.google.ca/maps/place/Canadian+Tire/@43.1718328,-80.2474798,17z/data=!3m1!4b1!4m10!1m2!2m1!1scanadian+tire!3m6!1s0x882c65baad6f5e09:0x2b32377dd4265875!8m2!3d43.1718289!4d-80.2452911!9m1!1b1","Canadian Tire - Brantford, ON",Ryan  Anderson,Local Guide,if you know what youre buying its a quick trip... otherwise prepare to get lost and spend more on stuff than expected,5 stars,a month ago,https://www.google.com/maps/contrib/102739888572247487013/reviews?hl=en-CA,[],[]
21,3.3,703 reviews,"https://www.google.ca/maps/place/Canadian+Tire/@43.1718328,-80.2474798,17z/data=!3m1!4b1!4m10!1m2!2m1!1scanadian+tire!3m6!1s0x882c65baad6f5e09:0x2b32377dd4265875!8m2!3d43.1718289!4d-80.2452911!9m1!1b1","Canadian Tire - Brantford, ON",Michael  Scheck,Local Guide,"went in looking for a specific vacuum cleaner, which wasn't on the shelf. found a customer service person who was able to get the department person, and the young man was able to find out they had the vacuum and retrieved it from the stockroom for me. all in all an excellent experience. i will continue to shop there",4 stars,4 months ago,https://www.google.com/maps/contrib/105943511271168388649/reviews?hl=en-CA,"[found, customer, service, department, find, experience, shop]","[3, 2]"
22,3.3,703 reviews,"https://www.google.ca/maps/place/Canadian+Tire/@43.1718328,-80.2474798,17z/data=!3m1!4b1!4m10!1m2!2m1!1scanadian+tire!3m6!1s0x882c65baad6f5e09:0x2b32377dd4265875!8m2!3d43.1718289!4d-80.2452911!9m1!1b1","Canadian Tire - Brantford, ON",Eli  Rubio,Local Guide,"ordered online went to pick it up all under 20 min, nice.",4 stars,a month ago,https://www.google.com/maps/contrib/103168342501959413310/reviews?hl=en-CA,[online],[]
23,3.3,703 reviews,"https://www.google.ca/maps/place/Canadian+Tire/@43.1718328,-80.2474798,17z/data=!3m1!4b1!4m10!1m2!2m1!1scanadian+tire!3m6!1s0x882c65baad6f5e09:0x2b32377dd4265875!8m2!3d43.1718289!4d-80.2452911!9m1!1b1","Canadian Tire - Brantford, ON",Shaun  Harvey,Local Guide,this is a great place to shop. always has tools on sale,5 stars,a month ago,https://www.google.com/maps/contrib/101706914115187667403/reviews?hl=en-CA,"[great, place, shop, sale]",[3]
24,3.3,703 reviews,"https://www.google.ca/maps/place/Canadian+Tire/@43.1718328,-80.2474798,17z/data=!3m1!4b1!4m10!1m2!2m1!1scanadian+tire!3m6!1s0x882c65baad6f5e09:0x2b32377dd4265875!8m2!3d43.1718289!4d-80.2452911!9m1!1b1","Canadian Tire - Brantford, ON",Deborah  Butt-hewings,Local Guide,great customer service.toasters were on sale. there were no more on self.the lady in that dept looked up for us inventory found one for us.she was fantastic so friendly for boxing day sale the checkout clerk was so friendly as well.canadian tire is always so friendly and will look up if any item is in store in another location.,5 stars,3 months ago,https://www.google.com/maps/contrib/104353079625813450233/reviews?hl=en-CA,"[great, customer, sale, found, friendly, sale, friendly, tire, friendly, item, store, location]","[3, 1, 4]"
25,3.3,703 reviews,"https://www.google.ca/maps/place/Canadian+Tire/@43.1718328,-80.2474798,17z/data=!3m1!4b1!4m10!1m2!2m1!1scanadian+tire!3m6!1s0x882c65baad6f5e09:0x2b32377dd4265875!8m2!3d43.1718289!4d-80.2452911!9m1!1b1","Canadian Tire - Brantford, ON",Jane  Hill,"",they never have the stock in that the website states they have; it's hard to find someone to help you outside of the auto section; staff is rude when reluctantly assisting customers,1 star,an hour ago,https://www.google.com/maps/contrib/103606263384586000650/reviews?hl=en-CA,"[stock, hard, find, auto, staff, rude, customers]","[2, 1]"
26,3.3,703 reviews,"https://www.google.ca/maps/place/Canadian+Tire/@43.1718328,-80.2474798,17z/data=!3m1!4b1!4m10!1m2!2m1!1scanadian+tire!3m6!1s0x882c65baad6f5e09:0x2b32377dd4265875!8m2!3d43.1718289!4d-80.2452911!9m1!1b1","Canadian Tire - Brantford, ON",Ash,Local Guide,much much better than before. maybe work on their consumable sales items to bring customers in. these items are more likely to bring people in from walmart. smart up guys! don't make money on high q items to increase traffic. i wish them success as a canadian company in such competitive market.,4 stars,6 months ago,https://www.google.com/maps/contrib/115236050778659194765/reviews?hl=en-CA,"[work, sales, items, customers, items, people, items, canadian]","[2, 4]"
27,3.3,703 reviews,"https://www.google.ca/maps/place/Canadian+Tire/@43.1718328,-80.2474798,17z/data=!3m1!4b1!4m10!1m2!2m1!1scanadian+tire!3m6!1s0x882c65baad6f5e09:0x2b32377dd4265875!8m2!3d43.1718289!4d-80.2452911!9m1!1b1","Canadian Tire - Brantford, ON",Glen  Atwell,Local Guide,check the inventory on the website and call ahead and you can't fail. prices are a little high but if you need to fix somwthing they almost always have it or they can get it.,4 stars,a week ago,https://www.google.com/maps/contrib/113646916808663831819/reviews?hl=en-CA,"[check, prices]",[]
28,3.3,703 reviews,"https://www.google.ca/maps/place/Canadian+Tire/@43.1718328,-80.2474798,17z/data=!3m1!4b1!4m10!1m2!2m1!1scanadian+tire!3m6!1s0x882c65baad6f5e09:0x2b32377dd4265875!8m2!3d43.1718289!4d-80.2452911!9m1!1b1","Canadian Tire - Brantford, ON",Denise  Liberty,Local Guide,picked up an online order.. longish wait at customer service.. ct never has enough staff.. clerk was nice and very helpful but needed a manager over ride.. it would be nice if the store gave the staff the tools they need to do their jobs .,4 stars,6 months ago,https://www.google.com/maps/contrib/109515603026367992770/reviews?hl=en-CA,"[online, customer, service, staff, helpful, needed, manager, store, staff]","[2, 3, 1, 4]"
29,3.3,703 reviews,"https://www.google.ca/maps/place/Canadian+Tire/@43.1718328,-80.2474798,17z/data=!3m1!4b1!4m10!1m2!2m1!1scanadian+tire!3m6!1s0x882c65baad6f5e09:0x2b32377dd4265875!8m2!3d43.1718289!4d-80.2452911!9m1!1b1","Canadian Tire - Brantford, ON",Hratch,Local Guide,good ct. always in there getting the things i need when in town. friendly people as well.,5 stars,2 months ago,https://www.google.com/maps/contrib/117532128413668089701/reviews?hl=en-CA,"[good, things, friendly, people]","[4, 3]"
30,3.3,703 reviews,"https://www.google.ca/maps/place/Canadian+Tire/@43.1718328,-80.2474798,17z/data=!3m1!4b1!4m10!1m2!2m1!1scanadian+tire!3m6!1s0x882c65baad6f5e09:0x2b32377dd4265875!8m2!3d43.1718289!4d-80.2452911!9m1!1b1","Canadian Tire - Brantford, ON",Ron  Ward,Local Guide,50 dollars for a cabin air filter really! found the same one at competitor for 16 dollars if canadian tire seems a bit expensive it probably is . be carefull lots of items there are way over priced. every time i see this practice i think twice before going back,2 stars,a month ago,https://www.google.com/maps/contrib/105389830988090564583/reviews?hl=en-CA,"[found, canadian, tire, items, time, back]","[4, 2]"
31,3.3,703 reviews,"https://www.google.ca/maps/place/Canadian+Tire/@43.1718328,-80.2474798,17z/data=!3m1!4b1!4m10!1m2!2m1!1scanadian+tire!3m6!1s0x882c65baad6f5e09:0x2b32377dd4265875!8m2!3d43.1718289!4d-80.2452911!9m1!1b1","Canadian Tire - Brantford, ON",Jamie  Clements,"",went in to return some engine coolant paid cash at purchase could not find my receipt. i just wanted to get a store credit to pick up the correct product i need and was denied at the service desk for not having a receipt. upon leaving the …,1 star,4 months ago,https://www.google.com/maps/contrib/118313925558199841996/reviews?hl=en-CA,"[return, find, store, product, service, desk]","[1, 3, 2]"
32,3.3,703 reviews,"https://www.google.ca/maps/place/Canadian+Tire/@43.1718328,-80.2474798,17z/data=!3m1!4b1!4m10!1m2!2m1!1scanadian+tire!3m6!1s0x882c65baad6f5e09:0x2b32377dd4265875!8m2!3d43.1718289!4d-80.2452911!9m1!1b1","Canadian Tire - Brantford, ON",T  Do,Local Guide,"came in to get my e-test done...they don't do it here, booo. is it me, or has canadian tire lost its homely feel to it. i don't find myself going to canadian tire much these days.",4 stars,4 months ago,https://www.google.com/maps/contrib/106933797573263008000/reviews?hl=en-CA,"[canadian, tire, find, canadian, tire]","[4, 2]"
33,3.3,703 reviews,"https://www.google.ca/maps/place/Canadian+Tire/@43.1718328,-80.2474798,17z/data=!3m1!4b1!4m10!1m2!2m1!1scanadian+tire!3m6!1s0x882c65baad6f5e09:0x2b32377dd4265875!8m2!3d43.1718289!4d-80.2452911!9m1!1b1","Canadian Tire - Brantford, ON",Ryan  Guthrie,Local Guide,the canadian tire website said the brantford location had 8 ice melters in stock. i drove out of my way and was told at the store that those 8 bags were damaged and unsellable but they still show up as stock items. why in the world are they not removing damaged goods from stock? big inconvenience to me. fix your process.,2 stars,2 months ago,https://www.google.com/maps/contrib/109028820673257480979/reviews?hl=en-CA,"[canadian, tire, brantford, location, stock, told, store, stock, items, stock]","[1, 4, 2]"
34,3.3,703 reviews,"https://www.google.ca/maps/place/Canadian+Tire/@43.1718328,-80.2474798,17z/data=!3m1!4b1!4m10!1m2!2m1!1scanadian+tire!3m6!1s0x882c65baad6f5e09:0x2b32377dd4265875!8m2!3d43.1718289!4d-80.2452911!9m1!1b1","Canadian Tire - Brantford, ON",Joey  Carrano,Local Guide,coming from the states...this was a fun store to walk through,4 stars,a month ago,https://www.google.com/maps/contrib/104866011408741855750/reviews?hl=en-CA,[store],[1]
35,3.3,703 reviews,"https://www.google.ca/maps/place/Canadian+Tire/@43.1718328,-80.2474798,17z/data=!3m1!4b1!4m10!1m2!2m1!1scanadian+tire!3m6!1s0x882c65baad6f5e09:0x2b32377dd4265875!8m2!3d43.1718289!4d-80.2452911!9m1!1b1","Canadian Tire - Brantford, ON",alanjholly,Local Guide,always something to buy at newfie speed and sport. usually have what you want.,4 stars,2 months ago,https://www.google.com/maps/contrib/100576200676891482917/reviews?hl=en-CA,[],[]
36,3.3,703 reviews,"https://www.google.ca/maps/place/Canadian+Tire/@43.1718328,-80.2474798,17z/data=!3m1!4b1!4m10!1m2!2m1!1scanadian+tire!3m6!1s0x882c65baad6f5e09:0x2b32377dd4265875!8m2!3d43.1718289!4d-80.2452911!9m1!1b1","Canadian Tire - Brantford, ON",Fred  Gerritsen,Local Guide,great store. many great sales of real value.,5 stars,2 months ago,https://www.google.com/maps/contrib/116067612137760236600/reviews?hl=en-CA,"[great, store, great, sales]","[3, 1]"
37,3.3,703 reviews,"https://www.google.ca/maps/place/Canadian+Tire/@43.1718328,-80.2474798,17z/data=!3m1!4b1!4m10!1m2!2m1!1scanadian+tire!3m6!1s0x882c65baad6f5e09:0x2b32377dd4265875!8m2!3d43.1718289!4d-80.2452911!9m1!1b1","Canadian Tire - Brantford, ON",Michael  Baleck,"",very good needed salt picked up 4 bags right on !,5 stars,2 months ago,https://www.google.com/maps/contrib/107062690324913927303/reviews?hl=en-CA,"[good, needed]",[4]
38,3.3,703 reviews,"https://www.google.ca/maps/place/Canadian+Tire/@43.1718328,-80.2474798,17z/data=!3m1!4b1!4m10!1m2!2m1!1scanadian+tire!3m6!1s0x882c65baad6f5e09:0x2b32377dd4265875!8m2!3d43.1718289!4d-80.2452911!9m1!1b1","Canadian Tire - Brantford, ON",Susan  Johnson,Local Guide,"-5 rating!! worst auto service!!! my husband needed his brakes on his truck fixed and the only place we could get them done asap was here. he was quoted a price after they took it in to look at it, my husband said yes that was fine, fair …",1 star,6 months ago,https://www.google.com/maps/contrib/112153790307197551409/reviews?hl=en-CA,"[worst, auto, service, needed, place, price]","[3, 1, 4]"
39,3.3,703 reviews,"https://www.google.ca/maps/place/Canadian+Tire/@43.1718328,-80.2474798,17z/data=!3m1!4b1!4m10!1m2!2m1!1scanadian+tire!3m6!1s0x882c65baad6f5e09:0x2b32377dd4265875!8m2!3d43.1718289!4d-80.2452911!9m1!1b1","Canadian Tire - Brantford, ON",Ryan  Brown,"","very bad service, even tried to order online pickup and they couldn't do that either. horrible store",1 star,a week ago,https://www.google.com/maps/contrib/103410522933684098196/reviews?hl=en-CA,"[service, online, store]","[1, 3]"
40,3.3,703 reviews,"https://www.google.ca/maps/place/Canadian+Tire/@43.1718328,-80.2474798,17z/data=!3m1!4b1!4m10!1m2!2m1!1scanadian+tire!3m6!1s0x882c65baad6f5e09:0x2b32377dd4265875!8m2!3d43.1718289!4d-80.2452911!9m1!1b1","Canadian Tire - Brantford, ON",John-Mike  Bolognone,Local Guide,this was canadian tire was great. all of the staff was very friendly. the girl at the customer service desk was so helpful! great experience!,5 stars,6 months ago,https://www.google.com/maps/contrib/118012425116261125684/reviews?hl=en-CA,"[canadian, tire, great, staff, friendly, customer, service, desk, helpful, great, experience]","[3, 4, 2]"
41,3.3,703 reviews,"https://www.google.ca/maps/place/Canadian+Tire/@43.1718328,-80.2474798,17z/data=!3m1!4b1!4m10!1m2!2m1!1scanadian+tire!3m6!1s0x882c65baad6f5e09:0x2b32377dd4265875!8m2!3d43.1718289!4d-80.2452911!9m1!1b1","Canadian Tire - Brantford, ON",Murphy  Hawthorne,Local Guide,good quality merchandise and wide selection.,4 stars,6 days ago,https://www.google.com/maps/contrib/104187801349185124232/reviews?hl=en-CA,"[good, selection]",[4]
42,3.3,703 reviews,"https://www.google.ca/maps/place/Canadian+Tire/@43.1718328,-80.2474798,17z/data=!3m1!4b1!4m10!1m2!2m1!1scanadian+tire!3m6!1s0x882c65baad6f5e09:0x2b32377dd4265875!8m2!3d43.1718289!4d-80.2452911!9m1!1b1","Canadian Tire - Brantford, ON",Mike  Regan,"",i wish i could give this store 0 stars. i placed an online order for home delivery through this store since they had the product in stock. and for some unknown dumb reason someone from this store cancelled my delivery which was supposed to …,1 star,4 months ago,https://www.google.com/maps/contrib/102621473860345453909/reviews?hl=en-CA,"[store, online, store, product, stock, store]",[1]
