GOOGLE_REVIEWS ID,Business Rating,Business Reviews,Source URL,Business Name,Author Name,Local Guide,Review Text,Review Rating,Review Date,Author URL,Topic Keywords,Topics
284,3.3,703 reviews,"https://www.google.ca/maps/place/Canadian+Tire/@43.1718328,-80.2474798,17z/data=!3m1!4b1!4m10!1m2!2m1!1scanadian+tire!3m6!1s0x882c65baad6f5e09:0x2b32377dd4265875!8m2!3d43.1718289!4d-80.2452911!9m1!1b1","Canadian Tire - Brantford, ON",Brandon  St.  Amand,"",terrible service. not a single person could help me find what i was looking for. walked out. will not be going back to this location.,1 star,a year ago,https://www.google.com/maps/contrib/112834284534056079359/reviews?hl=en-CA,"[terrible, service, find, back, location]","[3, 2]"
285,3.3,703 reviews,"https://www.google.ca/maps/place/Canadian+Tire/@43.1718328,-80.2474798,17z/data=!3m1!4b1!4m10!1m2!2m1!1scanadian+tire!3m6!1s0x882c65baad6f5e09:0x2b32377dd4265875!8m2!3d43.1718289!4d-80.2452911!9m1!1b1","Canadian Tire - Brantford, ON",Mark  Pike,"",same as always know one to be found to help you they see you and run the other way the worst customer service ever,1 star,11 months ago,https://www.google.com/maps/contrib/113758367666788981227/reviews?hl=en-CA,"[found, worst, customer, service]",[3]
286,3.3,703 reviews,"https://www.google.ca/maps/place/Canadian+Tire/@43.1718328,-80.2474798,17z/data=!3m1!4b1!4m10!1m2!2m1!1scanadian+tire!3m6!1s0x882c65baad6f5e09:0x2b32377dd4265875!8m2!3d43.1718289!4d-80.2452911!9m1!1b1","Canadian Tire - Brantford, ON",Mary  Grieves,"","went for a tire repair was told that my tire had to be replaced,my tire was unrepairable i needed a new tire, however the hole was in a perfect spot to be plugged so i refuse the new tire, took my car to cainsville the next morning it was plugged without a problem i have a perfectly good tire . wish they had the option of 0 stars",1 star,a year ago,https://www.google.com/maps/contrib/104440089158184151321/reviews?hl=en-CA,"[tire, told, tire, tire, needed, tire, tire, good, tire]",[4]
287,3.3,703 reviews,"https://www.google.ca/maps/place/Canadian+Tire/@43.1718328,-80.2474798,17z/data=!3m1!4b1!4m10!1m2!2m1!1scanadian+tire!3m6!1s0x882c65baad6f5e09:0x2b32377dd4265875!8m2!3d43.1718289!4d-80.2452911!9m1!1b1","Canadian Tire - Brantford, ON",Jack  Kralt,"",good. this store stands behind what it sells. recently returned a very inferior product and even tho jenn had 7 day exchange store have me a full refund,5 stars,a year ago,https://www.google.com/maps/contrib/115721569017351146842/reviews?hl=en-CA,"[good, store, product, store]","[1, 4]"
288,3.3,703 reviews,"https://www.google.ca/maps/place/Canadian+Tire/@43.1718328,-80.2474798,17z/data=!3m1!4b1!4m10!1m2!2m1!1scanadian+tire!3m6!1s0x882c65baad6f5e09:0x2b32377dd4265875!8m2!3d43.1718289!4d-80.2452911!9m1!1b1","Canadian Tire - Brantford, ON",Greg  Van  Gastel,Local Guide,friendly staff but this place is understaffed or totally disorganised. it took over an hour to get our oil changed because they had long lines of customers at 7:30pm and needed desperately to tell me that my air filter was getting dirty. …,2 stars,a year ago,https://www.google.com/maps/contrib/112519079392853342613/reviews?hl=en-CA,"[friendly, staff, place, customers, needed]","[2, 3, 4]"
289,3.3,703 reviews,"https://www.google.ca/maps/place/Canadian+Tire/@43.1718328,-80.2474798,17z/data=!3m1!4b1!4m10!1m2!2m1!1scanadian+tire!3m6!1s0x882c65baad6f5e09:0x2b32377dd4265875!8m2!3d43.1718289!4d-80.2452911!9m1!1b1","Canadian Tire - Brantford, ON",Josh  Novosedlik,"",cheap management doesnt want to pay their employees so they close at 6 mon tues and wed.,1 star,a year ago,https://www.google.com/maps/contrib/102940868393632038531/reviews?hl=en-CA,[employees],[]
290,3.3,703 reviews,"https://www.google.ca/maps/place/Canadian+Tire/@43.1718328,-80.2474798,17z/data=!3m1!4b1!4m10!1m2!2m1!1scanadian+tire!3m6!1s0x882c65baad6f5e09:0x2b32377dd4265875!8m2!3d43.1718289!4d-80.2452911!9m1!1b1","Canadian Tire - Brantford, ON",Taraneh  Amini,"",terrible customer service,1 star,5 months ago,https://www.google.com/maps/contrib/104458562652647531518/reviews?hl=en-CA,"[terrible, customer, service]",[3]
291,3.3,703 reviews,"https://www.google.ca/maps/place/Canadian+Tire/@43.1718328,-80.2474798,17z/data=!3m1!4b1!4m10!1m2!2m1!1scanadian+tire!3m6!1s0x882c65baad6f5e09:0x2b32377dd4265875!8m2!3d43.1718289!4d-80.2452911!9m1!1b1","Canadian Tire - Brantford, ON",Nathan,"","do not use service dept. car towed in to replace the alternator. did serpentine belt same time. next morning belt falls off, a/c no longer works. took it to another garage, turns out service department bent the tensioner during replacement, …",1 star,a year ago,https://www.google.com/maps/contrib/111525740042504611190/reviews?hl=en-CA,"[service, time, service, department]","[3, 2]"
292,3.3,703 reviews,"https://www.google.ca/maps/place/Canadian+Tire/@43.1718328,-80.2474798,17z/data=!3m1!4b1!4m10!1m2!2m1!1scanadian+tire!3m6!1s0x882c65baad6f5e09:0x2b32377dd4265875!8m2!3d43.1718289!4d-80.2452911!9m1!1b1","Canadian Tire - Brantford, ON",Mikael  Devost,Local Guide,poor service,1 star,3 months ago,https://www.google.com/maps/contrib/108356145235465267636/reviews?hl=en-CA,"[poor, service]",[3]
293,3.3,703 reviews,"https://www.google.ca/maps/place/Canadian+Tire/@43.1718328,-80.2474798,17z/data=!3m1!4b1!4m10!1m2!2m1!1scanadian+tire!3m6!1s0x882c65baad6f5e09:0x2b32377dd4265875!8m2!3d43.1718289!4d-80.2452911!9m1!1b1","Canadian Tire - Brantford, ON",Carolyn  Drummond,Local Guide,"good selection. tidy store, comparable prices.",4 stars,a year ago,https://www.google.com/maps/contrib/109976210634151901153/reviews?hl=en-CA,"[good, selection, store, prices]","[1, 4]"
294,3.3,703 reviews,"https://www.google.ca/maps/place/Canadian+Tire/@43.1718328,-80.2474798,17z/data=!3m1!4b1!4m10!1m2!2m1!1scanadian+tire!3m6!1s0x882c65baad6f5e09:0x2b32377dd4265875!8m2!3d43.1718289!4d-80.2452911!9m1!1b1","Canadian Tire - Brantford, ON",Martin  Vanderspek,Local Guide,excellent place for gas,4 stars,9 months ago,https://www.google.com/maps/contrib/113927467532804145671/reviews?hl=en-CA,[place],[3]
295,3.3,703 reviews,"https://www.google.ca/maps/place/Canadian+Tire/@43.1718328,-80.2474798,17z/data=!3m1!4b1!4m10!1m2!2m1!1scanadian+tire!3m6!1s0x882c65baad6f5e09:0x2b32377dd4265875!8m2!3d43.1718289!4d-80.2452911!9m1!1b1","Canadian Tire - Brantford, ON",Diane  Murray,"","appalling situation on sat.,may 6 at 10:15am!!!! girls in returns telling all customers that there was no printer paper so they couldn't return anything so go shopping for awhile! supervisor returns and indicates there's no paper anywhere! …",1 star,a year ago,https://www.google.com/maps/contrib/104622470730286665289/reviews?hl=en-CA,"[customers, return]",[]
296,3.3,703 reviews,"https://www.google.ca/maps/place/Canadian+Tire/@43.1718328,-80.2474798,17z/data=!3m1!4b1!4m10!1m2!2m1!1scanadian+tire!3m6!1s0x882c65baad6f5e09:0x2b32377dd4265875!8m2!3d43.1718289!4d-80.2452911!9m1!1b1","Canadian Tire - Brantford, ON",Sean  Colwell,"",i asked for a price match - they said they couldn't do it. i called paris canadian tire and they told me no problem. purchased the $1100 item there instead. don't waste your time at this location.,1 star,3 years ago,https://www.google.com/maps/contrib/106893577473093718911/reviews?hl=en-CA,"[asked, price, canadian, tire, told, item, time, location]","[4, 2, 1]"
297,3.3,703 reviews,"https://www.google.ca/maps/place/Canadian+Tire/@43.1718328,-80.2474798,17z/data=!3m1!4b1!4m10!1m2!2m1!1scanadian+tire!3m6!1s0x882c65baad6f5e09:0x2b32377dd4265875!8m2!3d43.1718289!4d-80.2452911!9m1!1b1","Canadian Tire - Brantford, ON",Brent  Lyttle,Local Guide,"big store, huge selection",4 stars,10 months ago,https://www.google.com/maps/contrib/106964422271291470506/reviews?hl=en-CA,"[store, selection]",[1]
298,3.3,703 reviews,"https://www.google.ca/maps/place/Canadian+Tire/@43.1718328,-80.2474798,17z/data=!3m1!4b1!4m10!1m2!2m1!1scanadian+tire!3m6!1s0x882c65baad6f5e09:0x2b32377dd4265875!8m2!3d43.1718289!4d-80.2452911!9m1!1b1","Canadian Tire - Brantford, ON",Roger  Dockstader,Local Guide,good deals,5 stars,7 months ago,https://www.google.com/maps/contrib/109018104995726427902/reviews?hl=en-CA,[good],[4]
299,3.3,703 reviews,"https://www.google.ca/maps/place/Canadian+Tire/@43.1718328,-80.2474798,17z/data=!3m1!4b1!4m10!1m2!2m1!1scanadian+tire!3m6!1s0x882c65baad6f5e09:0x2b32377dd4265875!8m2!3d43.1718289!4d-80.2452911!9m1!1b1","Canadian Tire - Brantford, ON",TC  DRYWALL  &  CONTRACTING  Brantford,Local Guide,update after contacting head office i was able to speak with the manager of canadian tire .... we had a meeting and he was very professional. he did try suggesting that this worker is the best they have and is usually very good to …,3 stars,a year ago,https://www.google.com/maps/contrib/116820682353017218501/reviews?hl=en-CA,"[manager, canadian, tire, good]",[4]
300,3.3,703 reviews,"https://www.google.ca/maps/place/Canadian+Tire/@43.1718328,-80.2474798,17z/data=!3m1!4b1!4m10!1m2!2m1!1scanadian+tire!3m6!1s0x882c65baad6f5e09:0x2b32377dd4265875!8m2!3d43.1718289!4d-80.2452911!9m1!1b1","Canadian Tire - Brantford, ON",Andrea  Rock,Local Guide,good place for a variety of things in the small town its in.,4 stars,a year ago,https://www.google.com/maps/contrib/104640678686379096950/reviews?hl=en-CA,"[good, place, things]","[4, 3]"
301,3.3,703 reviews,"https://www.google.ca/maps/place/Canadian+Tire/@43.1718328,-80.2474798,17z/data=!3m1!4b1!4m10!1m2!2m1!1scanadian+tire!3m6!1s0x882c65baad6f5e09:0x2b32377dd4265875!8m2!3d43.1718289!4d-80.2452911!9m1!1b1","Canadian Tire - Brantford, ON",bud  balog,"",i got to canadian tire for there great deals and helpful service,5 stars,a year ago,https://www.google.com/maps/contrib/107699463526799123654/reviews?hl=en-CA,"[canadian, tire, great, helpful, service]","[4, 3]"
302,3.3,703 reviews,"https://www.google.ca/maps/place/Canadian+Tire/@43.1718328,-80.2474798,17z/data=!3m1!4b1!4m10!1m2!2m1!1scanadian+tire!3m6!1s0x882c65baad6f5e09:0x2b32377dd4265875!8m2!3d43.1718289!4d-80.2452911!9m1!1b1","Canadian Tire - Brantford, ON",Deborah  Dammon,"",as we were leaving brantford canadian tire i am sure it was the manager and she was going cha chagin like everyone who was bye merchandise the money was going straight to her pocket it rub me the wrong way,1 star,a year ago,https://www.google.com/maps/contrib/113096792976987725193/reviews?hl=en-CA,"[brantford, canadian, tire, manager]",[4]
303,3.3,703 reviews,"https://www.google.ca/maps/place/Canadian+Tire/@43.1718328,-80.2474798,17z/data=!3m1!4b1!4m10!1m2!2m1!1scanadian+tire!3m6!1s0x882c65baad6f5e09:0x2b32377dd4265875!8m2!3d43.1718289!4d-80.2452911!9m1!1b1","Canadian Tire - Brantford, ON",Rob  Thomson,Local Guide,store somewhat disorginzed,3 stars,7 months ago,https://www.google.com/maps/contrib/110392780167225256869/reviews?hl=en-CA,[store],[1]
304,3.3,703 reviews,"https://www.google.ca/maps/place/Canadian+Tire/@43.1718328,-80.2474798,17z/data=!3m1!4b1!4m10!1m2!2m1!1scanadian+tire!3m6!1s0x882c65baad6f5e09:0x2b32377dd4265875!8m2!3d43.1718289!4d-80.2452911!9m1!1b1","Canadian Tire - Brantford, ON",Carolyn  Atfield,"",very rude staff. told me the price of a battery for my car was 129 then made me sign papers with a higher price and said it was a contract since i signed had to pay the higher price. dont sign anything there!,1 star,a year ago,https://www.google.com/maps/contrib/105506423764316068515/reviews?hl=en-CA,"[rude, staff, told, price, price, price]","[1, 2]"
305,3.3,703 reviews,"https://www.google.ca/maps/place/Canadian+Tire/@43.1718328,-80.2474798,17z/data=!3m1!4b1!4m10!1m2!2m1!1scanadian+tire!3m6!1s0x882c65baad6f5e09:0x2b32377dd4265875!8m2!3d43.1718289!4d-80.2452911!9m1!1b1","Canadian Tire - Brantford, ON",Gwen  Poster,"","one thing about canadian tire is they always have plenty of sale items, unlike most other stores.",4 stars,a year ago,https://www.google.com/maps/contrib/117592388933312977669/reviews?hl=en-CA,"[canadian, tire, sale, items, stores]","[4, 2]"
306,3.3,703 reviews,"https://www.google.ca/maps/place/Canadian+Tire/@43.1718328,-80.2474798,17z/data=!3m1!4b1!4m10!1m2!2m1!1scanadian+tire!3m6!1s0x882c65baad6f5e09:0x2b32377dd4265875!8m2!3d43.1718289!4d-80.2452911!9m1!1b1","Canadian Tire - Brantford, ON",Glenn  Colford,"",the guy behind the counter at the service desk was very ignorant .very what man wears rings on there thumbs ....,1 star,a year ago,https://www.google.com/maps/contrib/107044964973379184134/reviews?hl=en-CA,"[service, desk]",[3]
307,3.3,703 reviews,"https://www.google.ca/maps/place/Canadian+Tire/@43.1718328,-80.2474798,17z/data=!3m1!4b1!4m10!1m2!2m1!1scanadian+tire!3m6!1s0x882c65baad6f5e09:0x2b32377dd4265875!8m2!3d43.1718289!4d-80.2452911!9m1!1b1","Canadian Tire - Brantford, ON",Deb  Longthorne,Local Guide,big store with a good selection of merchandise.,4 stars,a year ago,https://www.google.com/maps/contrib/111235421141411691030/reviews?hl=en-CA,"[store, good, selection]","[1, 4]"
308,3.3,703 reviews,"https://www.google.ca/maps/place/Canadian+Tire/@43.1718328,-80.2474798,17z/data=!3m1!4b1!4m10!1m2!2m1!1scanadian+tire!3m6!1s0x882c65baad6f5e09:0x2b32377dd4265875!8m2!3d43.1718289!4d-80.2452911!9m1!1b1","Canadian Tire - Brantford, ON",John  Sutherland,"","housewares staff bent over backwards to be helpful. very friendly, pleasure to deal with. and no, i have no relationship with canadian tire.",4 stars,2 years ago,https://www.google.com/maps/contrib/111583170539453662649/reviews?hl=en-CA,"[staff, helpful, friendly, canadian, tire]","[4, 2, 3]"
309,3.3,703 reviews,"https://www.google.ca/maps/place/Canadian+Tire/@43.1718328,-80.2474798,17z/data=!3m1!4b1!4m10!1m2!2m1!1scanadian+tire!3m6!1s0x882c65baad6f5e09:0x2b32377dd4265875!8m2!3d43.1718289!4d-80.2452911!9m1!1b1","Canadian Tire - Brantford, ON",willy  4,Local Guide,went for a oil change with the girlfriends suv,4 stars,11 months ago,https://www.google.com/maps/contrib/104375476834261026516/reviews?hl=en-CA,[],[]
310,3.3,703 reviews,"https://www.google.ca/maps/place/Canadian+Tire/@43.1718328,-80.2474798,17z/data=!3m1!4b1!4m10!1m2!2m1!1scanadian+tire!3m6!1s0x882c65baad6f5e09:0x2b32377dd4265875!8m2!3d43.1718289!4d-80.2452911!9m1!1b1","Canadian Tire - Brantford, ON",Dennis  Stark,"","the staff are not only incompetent and useless, they are arrogant and snotty. you can rarely find any help and if you miraculously manage to find someone, they are noticeably annoyed that you are asking for help. they rarely have sale items …",1 star,3 years ago,https://www.google.com/maps/contrib/109755744446859680787/reviews?hl=en-CA,"[staff, find, find, sale, items]",[2]
311,3.3,703 reviews,"https://www.google.ca/maps/place/Canadian+Tire/@43.1718328,-80.2474798,17z/data=!3m1!4b1!4m10!1m2!2m1!1scanadian+tire!3m6!1s0x882c65baad6f5e09:0x2b32377dd4265875!8m2!3d43.1718289!4d-80.2452911!9m1!1b1","Canadian Tire - Brantford, ON",P,Local Guide,terrible service. booked an appointment for an oil change for 3pm. showed up at 2:50 - waited until 3:15 for their automotive rep. in the end he never showed up and one of the mechanics punched in my info and took my keys. he told me my car …,1 star,4 years ago,https://www.google.com/maps/contrib/113415931725411352377/reviews?hl=en-CA,"[terrible, service, automotive, told]",[3]
312,3.3,703 reviews,"https://www.google.ca/maps/place/Canadian+Tire/@43.1718328,-80.2474798,17z/data=!3m1!4b1!4m10!1m2!2m1!1scanadian+tire!3m6!1s0x882c65baad6f5e09:0x2b32377dd4265875!8m2!3d43.1718289!4d-80.2452911!9m1!1b1","Canadian Tire - Brantford, ON",Chef  Mike,Local Guide,not much to say about a gas station,4 stars,9 months ago,https://www.google.com/maps/contrib/103015692808965901341/reviews?hl=en-CA,[],[]
313,3.3,703 reviews,"https://www.google.ca/maps/place/Canadian+Tire/@43.1718328,-80.2474798,17z/data=!3m1!4b1!4m10!1m2!2m1!1scanadian+tire!3m6!1s0x882c65baad6f5e09:0x2b32377dd4265875!8m2!3d43.1718289!4d-80.2452911!9m1!1b1","Canadian Tire - Brantford, ON",Dave  Herrmann,"",went in for oil change it was very quick,4 stars,a year ago,https://www.google.com/maps/contrib/101437026204989601546/reviews?hl=en-CA,[],[]
314,3.3,703 reviews,"https://www.google.ca/maps/place/Canadian+Tire/@43.1718328,-80.2474798,17z/data=!3m1!4b1!4m10!1m2!2m1!1scanadian+tire!3m6!1s0x882c65baad6f5e09:0x2b32377dd4265875!8m2!3d43.1718289!4d-80.2452911!9m1!1b1","Canadian Tire - Brantford, ON",Brian  Kelly,"",very helpful and pleasant place to be.,5 stars,a year ago,https://www.google.com/maps/contrib/115232856218756210547/reviews?hl=en-CA,"[helpful, place]","[4, 3]"
315,3.3,703 reviews,"https://www.google.ca/maps/place/Canadian+Tire/@43.1718328,-80.2474798,17z/data=!3m1!4b1!4m10!1m2!2m1!1scanadian+tire!3m6!1s0x882c65baad6f5e09:0x2b32377dd4265875!8m2!3d43.1718289!4d-80.2452911!9m1!1b1","Canadian Tire - Brantford, ON",John  Rodgers,Local Guide,it's a franchise so it's the same everywhere. teenage staff with little or no knowledge of what they're selling. cell phones everywhere.,3 stars,9 months ago,https://www.google.com/maps/contrib/101841403990086158282/reviews?hl=en-CA,[staff],[2]
316,3.3,703 reviews,"https://www.google.ca/maps/place/Canadian+Tire/@43.1718328,-80.2474798,17z/data=!3m1!4b1!4m10!1m2!2m1!1scanadian+tire!3m6!1s0x882c65baad6f5e09:0x2b32377dd4265875!8m2!3d43.1718289!4d-80.2452911!9m1!1b1","Canadian Tire - Brantford, ON",Sue  Brant,"",so disappointed with the staff at this store. my husband shops there all the time. the last time he went in he had to purchase some rubber boots for work. nobody asked if he needed any help so he tried the boots on himself. after finding …,2 stars,2 years ago,https://www.google.com/maps/contrib/108016723255464732901/reviews?hl=en-CA,"[staff, store, time, time, work, asked, needed]","[2, 1, 4]"
317,3.3,703 reviews,"https://www.google.ca/maps/place/Canadian+Tire/@43.1718328,-80.2474798,17z/data=!3m1!4b1!4m10!1m2!2m1!1scanadian+tire!3m6!1s0x882c65baad6f5e09:0x2b32377dd4265875!8m2!3d43.1718289!4d-80.2452911!9m1!1b1","Canadian Tire - Brantford, ON",Shane  Crewson,Local Guide,server was snarky and officious. usually much better here.,2 stars,a year ago,https://www.google.com/maps/contrib/115377787271243861729/reviews?hl=en-CA,[],[]
318,3.3,703 reviews,"https://www.google.ca/maps/place/Canadian+Tire/@43.1718328,-80.2474798,17z/data=!3m1!4b1!4m10!1m2!2m1!1scanadian+tire!3m6!1s0x882c65baad6f5e09:0x2b32377dd4265875!8m2!3d43.1718289!4d-80.2452911!9m1!1b1","Canadian Tire - Brantford, ON",Jared  Hayward,"","booked an appointment for an alignment at 10am and by 12:15pm the car had not even been brought in the shop, when i asked the service staff all they could tell me is the tech is just finnishing another alignment (i work at a dealer and now …",1 star,2 years ago,https://www.google.com/maps/contrib/118095210919489836247/reviews?hl=en-CA,"[shop, asked, service, staff, work]","[2, 3]"
319,3.3,703 reviews,"https://www.google.ca/maps/place/Canadian+Tire/@43.1718328,-80.2474798,17z/data=!3m1!4b1!4m10!1m2!2m1!1scanadian+tire!3m6!1s0x882c65baad6f5e09:0x2b32377dd4265875!8m2!3d43.1718289!4d-80.2452911!9m1!1b1","Canadian Tire - Brantford, ON",Do  the  Drew,Local Guide,love canadian tire!,4 stars,7 months ago,https://www.google.com/maps/contrib/110503970653095633332/reviews?hl=en-CA,"[canadian, tire]",[4]
320,3.3,703 reviews,"https://www.google.ca/maps/place/Canadian+Tire/@43.1718328,-80.2474798,17z/data=!3m1!4b1!4m10!1m2!2m1!1scanadian+tire!3m6!1s0x882c65baad6f5e09:0x2b32377dd4265875!8m2!3d43.1718289!4d-80.2452911!9m1!1b1","Canadian Tire - Brantford, ON",julianpaulband  .,"","brantford canadian tire, booo! this is one of the most unprofessional canadian tire outlets i have ever experienced. your online computer stock is often incorrect and many staff, especially part time kids, can't be bothered to bring out new …",1 star,2 years ago,https://www.google.com/maps/contrib/114559896732003399569/reviews?hl=en-CA,"[brantford, canadian, tire, canadian, tire, online, stock, staff, time]","[4, 2, 1]"
321,3.3,703 reviews,"https://www.google.ca/maps/place/Canadian+Tire/@43.1718328,-80.2474798,17z/data=!3m1!4b1!4m10!1m2!2m1!1scanadian+tire!3m6!1s0x882c65baad6f5e09:0x2b32377dd4265875!8m2!3d43.1718289!4d-80.2452911!9m1!1b1","Canadian Tire - Brantford, ON",Robert  Mansfield,Local Guide,large store lots of selection.,4 stars,10 months ago,https://www.google.com/maps/contrib/110525210743210396435/reviews?hl=en-CA,"[store, selection]",[1]
322,3.3,703 reviews,"https://www.google.ca/maps/place/Canadian+Tire/@43.1718328,-80.2474798,17z/data=!3m1!4b1!4m10!1m2!2m1!1scanadian+tire!3m6!1s0x882c65baad6f5e09:0x2b32377dd4265875!8m2!3d43.1718289!4d-80.2452911!9m1!1b1","Canadian Tire - Brantford, ON",Eric  Bennett,Local Guide,i would like to add another pathetic auto shop experience. i went to get my motomaster se tires rotated and got a similar 1 hour plus delay experience after appointment time the same as i have read here. while watching the tires being …,1 star,2 years ago,https://www.google.com/maps/contrib/117098534603671597986/reviews?hl=en-CA,"[auto, shop, experience, tires, experience, time, tires]","[2, 1]"
323,3.3,703 reviews,"https://www.google.ca/maps/place/Canadian+Tire/@43.1718328,-80.2474798,17z/data=!3m1!4b1!4m10!1m2!2m1!1scanadian+tire!3m6!1s0x882c65baad6f5e09:0x2b32377dd4265875!8m2!3d43.1718289!4d-80.2452911!9m1!1b1","Canadian Tire - Brantford, ON",Rich  P,Local Guide,"warning if you have something to return or are in a hurry to buy and leave, don't do it at this location because there is a lack of staff as well as the computers seem to go down everytime i visit this store. so don't say that i didn't try to warn you!!",1 star,2 years ago,https://www.google.com/maps/contrib/111334715195465713867/reviews?hl=en-CA,"[return, location, staff, store]","[1, 2]"
324,3.3,703 reviews,"https://www.google.ca/maps/place/Canadian+Tire/@43.1718328,-80.2474798,17z/data=!3m1!4b1!4m10!1m2!2m1!1scanadian+tire!3m6!1s0x882c65baad6f5e09:0x2b32377dd4265875!8m2!3d43.1718289!4d-80.2452911!9m1!1b1","Canadian Tire - Brantford, ON",Eric  Lange,Local Guide,great folks,4 stars,10 months ago,https://www.google.com/maps/contrib/110491688261989398631/reviews?hl=en-CA,[great],[3]
325,3.3,703 reviews,"https://www.google.ca/maps/place/Canadian+Tire/@43.1718328,-80.2474798,17z/data=!3m1!4b1!4m10!1m2!2m1!1scanadian+tire!3m6!1s0x882c65baad6f5e09:0x2b32377dd4265875!8m2!3d43.1718289!4d-80.2452911!9m1!1b1","Canadian Tire - Brantford, ON",Gary  Neudert,Local Guide,slow at customer service.,3 stars,10 months ago,https://www.google.com/maps/contrib/107293139167683987693/reviews?hl=en-CA,"[customer, service]",[3]
326,3.3,703 reviews,"https://www.google.ca/maps/place/Canadian+Tire/@43.1718328,-80.2474798,17z/data=!3m1!4b1!4m10!1m2!2m1!1scanadian+tire!3m6!1s0x882c65baad6f5e09:0x2b32377dd4265875!8m2!3d43.1718289!4d-80.2452911!9m1!1b1","Canadian Tire - Brantford, ON",Lincoln  Kuwabara,"",worst store in all of brantford and maybe canada hahaha. terrible customer service. takes forever to find someone who works there and if you do find somebody they will say they are busy and they're just price checking stuff waiting for …,1 star,2 years ago,https://www.google.com/maps/contrib/117952473171935079561/reviews?hl=en-CA,"[worst, store, brantford, terrible, customer, service, find, find, price]","[3, 2, 1]"
327,3.3,703 reviews,"https://www.google.ca/maps/place/Canadian+Tire/@43.1718328,-80.2474798,17z/data=!3m1!4b1!4m10!1m2!2m1!1scanadian+tire!3m6!1s0x882c65baad6f5e09:0x2b32377dd4265875!8m2!3d43.1718289!4d-80.2452911!9m1!1b1","Canadian Tire - Brantford, ON",cheryl  mcintosh,"","automotive staff were rude, arrogant and absolutely refused to be helpful. made us feel as if we should be kissing their rings and bowing down to their greatness. never again will i walk through the doors at any canadian tire. thanks for nothing.",1 star,3 years ago,https://www.google.com/maps/contrib/109734150293747603095/reviews?hl=en-CA,"[automotive, staff, rude, helpful, canadian, tire]","[4, 2]"
328,3.3,703 reviews,"https://www.google.ca/maps/place/Canadian+Tire/@43.1718328,-80.2474798,17z/data=!3m1!4b1!4m10!1m2!2m1!1scanadian+tire!3m6!1s0x882c65baad6f5e09:0x2b32377dd4265875!8m2!3d43.1718289!4d-80.2452911!9m1!1b1","Canadian Tire - Brantford, ON",DJ  Capybara,"","crap customer service in the store. never anyone available to help. lots of staff wandering around though...i'm using tsc or home hardware from now on. wish i could give it no stars. the only reason to go to this canadian tire is to get a sausage from the cart outside, they are awesome!",1 star,4 years ago,https://www.google.com/maps/contrib/116832303663574585738/reviews?hl=en-CA,"[customer, service, store, staff, canadian, tire]","[3, 4, 1, 2]"
329,3.3,703 reviews,"https://www.google.ca/maps/place/Canadian+Tire/@43.1718328,-80.2474798,17z/data=!3m1!4b1!4m10!1m2!2m1!1scanadian+tire!3m6!1s0x882c65baad6f5e09:0x2b32377dd4265875!8m2!3d43.1718289!4d-80.2452911!9m1!1b1","Canadian Tire - Brantford, ON",fernando  martire,"",poor service,1 star,5 months ago,https://www.google.com/maps/contrib/104069721389209516245/reviews?hl=en-CA,"[poor, service]",[3]
330,3.3,703 reviews,"https://www.google.ca/maps/place/Canadian+Tire/@43.1718328,-80.2474798,17z/data=!3m1!4b1!4m10!1m2!2m1!1scanadian+tire!3m6!1s0x882c65baad6f5e09:0x2b32377dd4265875!8m2!3d43.1718289!4d-80.2452911!9m1!1b1","Canadian Tire - Brantford, ON",Charles  Kisielewski,"","i went to buy a lawn mower battery, after picking the correct battery i wanted, i was turned away at the cashier and told i required paper work from the parts counter, since the lineup was long i decided i did not need the warranty and went …",1 star,4 years ago,https://www.google.com/maps/contrib/108291727221559335689/reviews?hl=en-CA,"[told, work]",[]
